{
  "$schema": "https://json-schema.org/draft/2020-12/schema",
  "$id": "https://kairosboot.io/schemas/job-report.v1.schema.json",
  "title": "KairosBoot JobReport v1",
  "type": "object",
  "additionalProperties": false,
  "required": [
    "schemaVersion",
    "jobId",
    "planSha256",
    "state",
    "startedAt",
    "finishedAt",
    "devices",
    "summary",
    "error"
  ],
  "properties": {
    "schemaVersion": { "const": 1 },
    "jobId": { "$ref": "#/$defs/identifier" },
    "planSha256": { "$ref": "#/$defs/sha256" },
    "state": {
      "type": "string",
      "enum": ["running", "succeeded", "partially_failed", "failed", "cancelled"]
    },
    "startedAt": { "$ref": "#/$defs/dateTime" },
    "finishedAt": { "$ref": "#/$defs/nullableDateTime" },
    "devices": {
      "type": "array",
      "items": { "$ref": "#/$defs/device" }
    },
    "summary": { "$ref": "#/$defs/summary" },
    "error": {
      "oneOf": [
        { "$ref": "#/$defs/error" },
        { "type": "null" }
      ]
    }
  },
  "allOf": [
    {
      "if": {
        "properties": { "state": { "const": "running" } },
        "required": ["state"]
      },
      "then": { "properties": { "finishedAt": { "type": "null" } } },
      "else": {
        "properties": {
          "finishedAt": { "$ref": "#/$defs/dateTime" },
          "summary": {
            "allOf": [
              { "$ref": "#/$defs/summary" },
              {
                "properties": {
                  "pending": { "const": 0 },
                  "running": { "const": 0 }
                }
              }
            ]
          },
          "devices": {
            "items": {
              "allOf": [
                { "$ref": "#/$defs/device" },
                {
                  "properties": {
                    "state": {
                      "enum": ["succeeded", "failed", "cancelled", "skipped"]
                    },
                    "steps": {
                      "items": {
                        "allOf": [
                          { "$ref": "#/$defs/step" },
                          {
                            "properties": {
                              "state": {
                                "enum": ["succeeded", "failed", "cancelled", "skipped"]
                              }
                            }
                          }
                        ]
                      }
                    }
                  }
                }
              ]
            }
          }
        }
      }
    },
    {
      "if": {
        "properties": { "state": { "enum": ["running", "succeeded", "partially_failed"] } },
        "required": ["state"]
      },
      "then": { "properties": { "error": { "type": "null" } } }
    },
    {
      "if": {
        "properties": { "state": { "const": "cancelled" } },
        "required": ["state"]
      },
      "then": {
        "properties": {
          "error": {
            "allOf": [
              { "$ref": "#/$defs/error" },
              { "properties": { "code": { "const": 8 }, "status": { "const": "cancelled" } } }
            ]
          }
        }
      }
    },
    {
      "if": {
        "properties": { "state": { "const": "failed" } },
        "required": ["state"]
      },
      "then": {
        "properties": {
          "error": {
            "oneOf": [
              { "$ref": "#/$defs/nonCancellationError" },
              { "type": "null" }
            ]
          }
        }
      }
    }
  ],
  "$defs": {
    "identifier": { "type": "string", "minLength": 1, "maxLength": 256 },
    "nullableString": {
      "type": ["string", "null"],
      "minLength": 1,
      "maxLength": 4096
    },
    "nullableDeviceIdentifier": {
      "type": ["string", "null"],
      "minLength": 1,
      "maxLength": 4096
    },
    "sha256": {
      "type": "string",
      "minLength": 64,
      "maxLength": 64,
      "pattern": "^[0-9a-f]{64}$"
    },
    "dateTime": {
      "type": "string",
      "format": "date-time",
      "pattern": "^[0-9]{4}-(?:0[1-9]|1[0-2])-(?:0[1-9]|[12][0-9]|3[01])T(?:[01][0-9]|2[0-3]):[0-5][0-9]:[0-5][0-9](?:\\.[0-9]+)?Z$"
    },
    "nullableDateTime": {
      "oneOf": [
        { "$ref": "#/$defs/dateTime" },
        { "type": "null" }
      ]
    },
    "error": {
      "type": "object",
      "additionalProperties": false,
      "required": [
        "code",
        "status",
        "message",
        "deviceIdentifier",
        "nativeCode",
        "transferCertainty"
      ],
      "properties": {
        "code": { "type": "integer", "minimum": 1, "maximum": 12 },
        "status": {
          "type": "string",
          "enum": [
            "invalid_argument",
            "out_of_memory",
            "not_supported",
            "no_device",
            "ambiguous_device",
            "busy",
            "timeout",
            "cancelled",
            "io",
            "internal",
            "protocol",
            "device_fail"
          ]
        },
        "message": { "type": "string", "maxLength": 16384 },
        "deviceIdentifier": { "$ref": "#/$defs/nullableDeviceIdentifier" },
        "nativeCode": {
          "type": ["integer", "null"],
          "minimum": -2147483648,
          "maximum": 2147483647
        },
        "transferCertainty": {
          "enum": [null, "not_sent", "partial_or_unknown", "fully_transferred"]
        }
      },
      "oneOf": [
        { "properties": { "code": { "const": 1 }, "status": { "const": "invalid_argument" } } },
        { "properties": { "code": { "const": 2 }, "status": { "const": "out_of_memory" } } },
        { "properties": { "code": { "const": 3 }, "status": { "const": "not_supported" } } },
        { "properties": { "code": { "const": 4 }, "status": { "const": "no_device" } } },
        { "properties": { "code": { "const": 5 }, "status": { "const": "ambiguous_device" } } },
        { "properties": { "code": { "const": 6 }, "status": { "const": "busy" } } },
        { "properties": { "code": { "const": 7 }, "status": { "const": "timeout" } } },
        { "properties": { "code": { "const": 8 }, "status": { "const": "cancelled" } } },
        { "properties": { "code": { "const": 9 }, "status": { "const": "io" } } },
        { "properties": { "code": { "const": 10 }, "status": { "const": "internal" } } },
        { "properties": { "code": { "const": 11 }, "status": { "const": "protocol" } } },
        { "properties": { "code": { "const": 12 }, "status": { "const": "device_fail" } } }
      ]
    },
    "nonCancellationError": {
      "allOf": [
        { "$ref": "#/$defs/error" },
        {
          "properties": {
            "code": { "enum": [1, 2, 3, 4, 5, 6, 7, 9, 10, 11, 12] }
          }
        }
      ]
    },
    "step": {
      "type": "object",
      "additionalProperties": false,
      "required": [
        "index",
        "operation",
        "partition",
        "artifact",
        "slot",
        "rebootTarget",
        "oemCommand",
        "state",
        "startedAt",
        "finishedAt",
        "bytesTotal",
        "bytesTransferred",
        "error"
      ],
      "properties": {
        "index": { "type": "integer", "minimum": 0 },
        "operation": {
          "type": "string",
          "enum": ["flash", "erase", "set_active", "reboot", "oem"]
        },
        "partition": { "$ref": "#/$defs/nullableString" },
        "artifact": { "$ref": "#/$defs/nullableString" },
        "slot": { "enum": [null, "current", "other", "all", "a", "b"] },
        "rebootTarget": { "enum": [null, "system", "bootloader", "recovery", "fastboot"] },
        "oemCommand": { "$ref": "#/$defs/nullableString" },
        "state": {
          "type": "string",
          "enum": ["pending", "running", "succeeded", "failed", "cancelled", "skipped"]
        },
        "startedAt": { "$ref": "#/$defs/nullableDateTime" },
        "finishedAt": { "$ref": "#/$defs/nullableDateTime" },
        "bytesTotal": {
          "type": ["integer", "null"],
          "minimum": 0,
          "maximum": 9007199254740991
        },
        "bytesTransferred": {
          "type": ["integer", "null"],
          "minimum": 0,
          "maximum": 9007199254740991
        },
        "error": {
          "oneOf": [
            { "$ref": "#/$defs/error" },
            { "type": "null" }
          ]
        }
      },
      "allOf": [
        {
          "if": { "properties": { "operation": { "const": "flash" } }, "required": ["operation"] },
          "then": {
            "properties": {
              "partition": { "type": "string" },
              "artifact": { "type": "string" },
              "rebootTarget": { "type": "null" },
              "oemCommand": { "type": "null" },
              "bytesTotal": { "type": "integer" },
              "bytesTransferred": { "type": "integer" }
            }
          }
        },
        {
          "if": { "properties": { "operation": { "const": "erase" } }, "required": ["operation"] },
          "then": {
            "properties": {
              "partition": { "type": "string" },
              "artifact": { "type": "null" },
              "slot": { "type": "null" },
              "rebootTarget": { "type": "null" },
              "oemCommand": { "type": "null" },
              "bytesTotal": { "type": "null" },
              "bytesTransferred": { "type": "null" }
            }
          }
        },
        {
          "if": { "properties": { "operation": { "const": "set_active" } }, "required": ["operation"] },
          "then": {
            "properties": {
              "partition": { "type": "null" },
              "artifact": { "type": "null" },
              "slot": { "enum": ["other", "a", "b"] },
              "rebootTarget": { "type": "null" },
              "oemCommand": { "type": "null" },
              "bytesTotal": { "type": "null" },
              "bytesTransferred": { "type": "null" }
            }
          }
        },
        {
          "if": { "properties": { "operation": { "const": "reboot" } }, "required": ["operation"] },
          "then": {
            "properties": {
              "partition": { "type": "null" },
              "artifact": { "type": "null" },
              "slot": { "type": "null" },
              "rebootTarget": { "enum": ["system", "bootloader", "recovery", "fastboot"] },
              "oemCommand": { "type": "null" },
              "bytesTotal": { "type": "null" },
              "bytesTransferred": { "type": "null" }
            }
          }
        },
        {
          "if": { "properties": { "operation": { "const": "oem" } }, "required": ["operation"] },
          "then": {
            "properties": {
              "partition": { "type": "null" },
              "artifact": { "type": "null" },
              "slot": { "type": "null" },
              "rebootTarget": { "type": "null" },
              "oemCommand": { "type": "string" },
              "bytesTotal": { "type": "null" },
              "bytesTransferred": { "type": "null" }
            }
          }
        },
        {
          "if": { "properties": { "state": { "const": "pending" } }, "required": ["state"] },
          "then": {
            "properties": {
              "startedAt": { "type": "null" },
              "finishedAt": { "type": "null" },
              "error": { "type": "null" }
            }
          }
        },
        {
          "if": { "properties": { "state": { "const": "running" } }, "required": ["state"] },
          "then": {
            "properties": {
              "startedAt": { "$ref": "#/$defs/dateTime" },
              "finishedAt": { "type": "null" },
              "error": { "type": "null" }
            }
          }
        },
        {
          "if": { "properties": { "state": { "const": "succeeded" } }, "required": ["state"] },
          "then": {
            "properties": {
              "startedAt": { "$ref": "#/$defs/dateTime" },
              "finishedAt": { "$ref": "#/$defs/dateTime" },
              "error": { "type": "null" }
            }
          }
        },
        {
          "if": { "properties": { "state": { "const": "failed" } }, "required": ["state"] },
          "then": {
            "properties": {
              "startedAt": { "$ref": "#/$defs/dateTime" },
              "finishedAt": { "$ref": "#/$defs/dateTime" },
              "error": { "$ref": "#/$defs/nonCancellationError" }
            }
          }
        },
        {
          "if": { "properties": { "state": { "const": "cancelled" } }, "required": ["state"] },
          "then": {
            "properties": {
              "finishedAt": { "$ref": "#/$defs/dateTime" },
              "error": {
                "allOf": [
                  { "$ref": "#/$defs/error" },
                  { "properties": { "code": { "const": 8 }, "status": { "const": "cancelled" } } }
                ]
              }
            }
          }
        },
        {
          "if": { "properties": { "state": { "const": "skipped" } }, "required": ["state"] },
          "then": {
            "properties": {
              "startedAt": { "type": "null" },
              "finishedAt": { "$ref": "#/$defs/dateTime" },
              "error": { "type": "null" }
            }
          }
        },
        {
          "if": {
            "allOf": [
              {
                "properties": { "operation": { "const": "flash" } },
                "required": ["operation"]
              },
              {
                "properties": { "state": { "enum": ["pending", "skipped"] } },
                "required": ["state"]
              }
            ]
          },
          "then": {
            "properties": { "bytesTransferred": { "const": 0 } }
          }
        }
      ]
    },
    "device": {
      "type": "object",
      "additionalProperties": false,
      "required": [
        "identifier",
        "serial",
        "usbPath",
        "target",
        "observedProduct",
        "state",
        "steps",
        "error"
      ],
      "properties": {
        "identifier": { "type": "string", "minLength": 1, "maxLength": 4096 },
        "serial": { "$ref": "#/$defs/nullableString" },
        "usbPath": { "$ref": "#/$defs/nullableString" },
        "target": { "$ref": "#/$defs/identifier" },
        "observedProduct": { "$ref": "#/$defs/nullableString" },
        "state": {
          "type": "string",
          "enum": ["pending", "running", "succeeded", "failed", "cancelled", "skipped"]
        },
        "steps": {
          "type": "array",
          "minItems": 1,
          "maxItems": 16384,
          "items": { "$ref": "#/$defs/step" }
        },
        "error": {
          "oneOf": [
            { "$ref": "#/$defs/error" },
            { "type": "null" }
          ]
        }
      },
      "allOf": [
        {
          "if": {
            "properties": { "state": { "enum": ["pending", "running", "succeeded", "skipped"] } },
            "required": ["state"]
          },
          "then": { "properties": { "error": { "type": "null" } } }
        },
        {
          "if": { "properties": { "state": { "const": "failed" } }, "required": ["state"] },
          "then": {
            "properties": {
              "error": { "$ref": "#/$defs/nonCancellationError" }
            }
          }
        },
        {
          "if": { "properties": { "state": { "const": "cancelled" } }, "required": ["state"] },
          "then": {
            "properties": {
              "error": {
                "allOf": [
                  { "$ref": "#/$defs/error" },
                  { "properties": { "code": { "const": 8 }, "status": { "const": "cancelled" } } }
                ]
              }
            }
          }
        }
      ]
    },
    "summary": {
      "type": "object",
      "additionalProperties": false,
      "required": ["total", "pending", "running", "succeeded", "failed", "cancelled", "skipped"],
      "properties": {
        "total": { "type": "integer", "minimum": 0, "maximum": 9007199254740991 },
        "pending": { "type": "integer", "minimum": 0, "maximum": 9007199254740991 },
        "running": { "type": "integer", "minimum": 0, "maximum": 9007199254740991 },
        "succeeded": { "type": "integer", "minimum": 0, "maximum": 9007199254740991 },
        "failed": { "type": "integer", "minimum": 0, "maximum": 9007199254740991 },
        "cancelled": { "type": "integer", "minimum": 0, "maximum": 9007199254740991 },
        "skipped": { "type": "integer", "minimum": 0, "maximum": 9007199254740991 }
      }
    }
  }
}
