{"devices":[{"error":null,"identifier":"usb:1-2","observedProduct":"product_a","serial":"SERIAL-01","state":"succeeded","steps":[{"artifact":"system","bytesTotal":4096,"bytesTransferred":4096,"error":null,"finishedAt":"2026-08-27T06:00:02Z","index":0,"oemCommand":null,"operation":"flash","partition":"system","rebootTarget":null,"slot":null,"startedAt":"2026-08-27T06:00:01Z","state":"succeeded"}],"target":"product-a","usbPath":"usb:1-2"},{"error":{"code":12,"deviceIdentifier":"usb:1-3","message":"device rejected flash command","nativeCode":null,"status":"device_fail","transferCertainty":"fully_transferred"},"identifier":"usb:1-3","observedProduct":"product_a","serial":"SERIAL-02","state":"failed","steps":[{"artifact":"system","bytesTotal":4096,"bytesTransferred":4096,"error":{"code":12,"deviceIdentifier":"usb:1-3","message":"device rejected flash command","nativeCode":null,"status":"device_fail","transferCertainty":"fully_transferred"},"finishedAt":"2026-08-27T06:00:03Z","index":0,"oemCommand":null,"operation":"flash","partition":"system","rebootTarget":null,"slot":null,"startedAt":"2026-08-27T06:00:01Z","state":"failed"}],"target":"product-a","usbPath":"usb:1-3"}],"error":null,"finishedAt":"2026-08-27T06:00:03Z","jobId":"job-0001","planSha256":"992daa21b5ea246910fc5d9ffffafed3e36e883d6a407b70abe3b04def3823f4","schemaVersion":1,"startedAt":"2026-08-27T06:00:00Z","state":"partially_failed","summary":{"cancelled":0,"failed":1,"pending":0,"running":0,"skipped":0,"succeeded":1,"total":2}}
